{
  "schema_version": 1,
  "issue": 25,
  "gate": 29,
  "terminal_evidence": "E4",
  "artifact_edges": [
    {
      "from": 21,
      "to": 25,
      "class": "freeze",
      "artifact": "strategy and tier semantics"
    },
    {
      "from": 24,
      "to": 25,
      "class": "freeze",
      "artifact": "GPPE candidate output"
    }
  ]
}
