{
  "schema_version": 1,
  "issue": 251,
  "gate": 31,
  "terminal_evidence": "E3",
  "artifact_edges": [
    {
      "from": 40,
      "to": 251,
      "class": "freeze",
      "artifact": "accepted registered replay artifact"
    },
    {
      "from": 41,
      "to": 251,
      "class": "freeze",
      "artifact": "stable strategy and result query contract"
    },
    {
      "from": 42,
      "to": 251,
      "class": "freeze",
      "artifact": "accepted MCP transport and tool-registration handoff"
    },
    {
      "from": 229,
      "to": 251,
      "class": "start",
      "artifact": "accepted governed research access handoff"
    }
  ]
}
